{
  "boundary": "Deterministic repository metadata and Python-import analysis only; module budgets are warnings and no source is executed or rewritten.",
  "documentation": {
    "owner_contract": "tailtrail-meta/document-owners-v1.json",
    "owners": [
      {
        "owner": "tailtrail-product",
        "path": "README.md",
        "purpose": "public product entry point"
      },
      {
        "owner": "tailtrail-product",
        "path": "ROADMAP.md",
        "purpose": "canonical implementation roadmap"
      },
      {
        "owner": "tailtrail-core",
        "path": "TAILTRAIL-COMMANDS.md",
        "purpose": "canonical command reference"
      },
      {
        "owner": "tailtrail-core",
        "path": "PRODUCT-MATURITY-IMPROVEMENT-PLAN.md",
        "purpose": "product maturity phase contract"
      },
      {
        "owner": "tailtrail-core",
        "path": "MCP-SERVER.md",
        "purpose": "canonical MCP boundary"
      },
      {
        "owner": "tailtrail-install",
        "path": "INSTALL.md",
        "purpose": "canonical installation guide"
      }
    ]
  },
  "fingerprint": "7afba8d44b94aac4b7f18c894707dd64f5d40499ea78c309943600d53a59fe12",
  "modules": {
    "files": [
      {
        "imports": [],
        "layer": "application",
        "line_count": 2,
        "path": "scripts/orchestration/__init__.py"
      },
      {
        "imports": [
          "__future__",
          "json",
          "pathlib",
          "typing"
        ],
        "layer": "application",
        "line_count": 45,
        "path": "scripts/orchestration/run_resolution.py"
      },
      {
        "imports": [],
        "layer": "domain",
        "line_count": 6,
        "path": "scripts/workflow_runtime/__init__.py"
      },
      {
        "imports": [
          "__future__",
          "typing"
        ],
        "layer": "domain",
        "line_count": 135,
        "path": "scripts/workflow_runtime/adapter_catalog.py"
      },
      {
        "imports": [
          "__future__",
          "datetime",
          "hashlib",
          "json",
          "pathlib",
          "typing",
          "workflow_runtime"
        ],
        "layer": "domain",
        "line_count": 165,
        "path": "scripts/workflow_runtime/adapters.py"
      },
      {
        "imports": [
          "__future__",
          "datetime",
          "hashlib",
          "json",
          "pathlib",
          "typing",
          "workflow_runtime"
        ],
        "layer": "domain",
        "line_count": 281,
        "path": "scripts/workflow_runtime/approvals.py"
      },
      {
        "imports": [
          "__future__",
          "hashlib",
          "importlib.util",
          "json",
          "pathlib",
          "typing",
          "workflow_runtime"
        ],
        "layer": "domain",
        "line_count": 59,
        "path": "scripts/workflow_runtime/assurance.py"
      },
      {
        "imports": [
          "__future__",
          "datetime",
          "hashlib",
          "json",
          "pathlib",
          "typing",
          "workflow_runtime"
        ],
        "layer": "domain",
        "line_count": 266,
        "path": "scripts/workflow_runtime/capabilities.py"
      },
      {
        "imports": [
          "__future__",
          "hashlib",
          "json",
          "pathlib",
          "typing",
          "workflow_runtime"
        ],
        "layer": "domain",
        "line_count": 163,
        "path": "scripts/workflow_runtime/ci.py"
      },
      {
        "imports": [
          "__future__",
          "hashlib",
          "json",
          "pathlib",
          "typing",
          "workflow_runtime"
        ],
        "layer": "domain",
        "line_count": 154,
        "path": "scripts/workflow_runtime/compiler.py"
      },
      {
        "imports": [
          "__future__",
          "datetime",
          "hashlib",
          "json",
          "pathlib",
          "typing",
          "workflow_runtime"
        ],
        "layer": "domain",
        "line_count": 110,
        "path": "scripts/workflow_runtime/context.py"
      },
      {
        "imports": [
          "__future__",
          "json",
          "pathlib",
          "re",
          "typing",
          "workflow_runtime"
        ],
        "layer": "domain",
        "line_count": 191,
        "path": "scripts/workflow_runtime/contracts.py"
      },
      {
        "imports": [
          "__future__",
          "hashlib",
          "json",
          "pathlib",
          "typing",
          "workflow_runtime"
        ],
        "layer": "domain",
        "line_count": 88,
        "path": "scripts/workflow_runtime/correction.py"
      },
      {
        "imports": [
          "__future__",
          "hashlib",
          "json",
          "pathlib",
          "typing",
          "workflow_runtime"
        ],
        "layer": "domain",
        "line_count": 69,
        "path": "scripts/workflow_runtime/denials.py"
      },
      {
        "imports": [
          "__future__",
          "hashlib",
          "json",
          "pathlib",
          "typing",
          "workflow_runtime"
        ],
        "layer": "domain",
        "line_count": 160,
        "path": "scripts/workflow_runtime/enterprise.py"
      },
      {
        "imports": [
          "__future__",
          "datetime",
          "json",
          "pathlib",
          "typing",
          "workflow_runtime"
        ],
        "layer": "domain",
        "line_count": 155,
        "path": "scripts/workflow_runtime/enterprise_recovery.py"
      },
      {
        "imports": [
          "__future__",
          "datetime",
          "json",
          "os",
          "pathlib",
          "typing",
          "workflow_runtime"
        ],
        "layer": "domain",
        "line_count": 140,
        "path": "scripts/workflow_runtime/enterprise_transport.py"
      },
      {
        "imports": [
          "__future__",
          "hashlib",
          "importlib.util",
          "json",
          "pathlib",
          "typing",
          "workflow_runtime"
        ],
        "layer": "domain",
        "line_count": 272,
        "path": "scripts/workflow_runtime/evidence.py"
      },
      {
        "imports": [
          "__future__",
          "hashlib",
          "json",
          "pathlib",
          "typing",
          "workflow_runtime"
        ],
        "layer": "domain",
        "line_count": 75,
        "path": "scripts/workflow_runtime/evidence_completion.py"
      },
      {
        "imports": [
          "__future__",
          "hashlib",
          "json",
          "pathlib",
          "typing",
          "workflow_runtime"
        ],
        "layer": "domain",
        "line_count": 229,
        "path": "scripts/workflow_runtime/executor.py"
      },
      {
        "imports": [
          "__future__",
          "hashlib",
          "json",
          "pathlib",
          "re",
          "typing",
          "workflow_runtime"
        ],
        "layer": "domain",
        "line_count": 195,
        "path": "scripts/workflow_runtime/freshness.py"
      },
      {
        "imports": [
          "__future__",
          "importlib.util",
          "json",
          "pathlib",
          "typing",
          "workflow_runtime"
        ],
        "layer": "domain",
        "line_count": 239,
        "path": "scripts/workflow_runtime/mcp_bridge.py"
      },
      {
        "imports": [
          "__future__",
          "datetime",
          "hashlib",
          "importlib.util",
          "json",
          "pathlib",
          "typing",
          "workflow_runtime"
        ],
        "layer": "domain",
        "line_count": 87,
        "path": "scripts/workflow_runtime/outcomes.py"
      },
      {
        "imports": [
          "__future__",
          "hashlib",
          "importlib.util",
          "json",
          "pathlib",
          "re",
          "typing"
        ],
        "layer": "domain",
        "line_count": 152,
        "path": "scripts/workflow_runtime/ownership.py"
      },
      {
        "imports": [
          "__future__",
          "typing",
          "workflow_runtime"
        ],
        "layer": "domain",
        "line_count": 127,
        "path": "scripts/workflow_runtime/projection.py"
      },
      {
        "imports": [
          "__future__"
        ],
        "layer": "domain",
        "line_count": 50,
        "path": "scripts/workflow_runtime/reason_codes.py"
      },
      {
        "imports": [
          "__future__",
          "hashlib",
          "importlib.util",
          "json",
          "pathlib",
          "typing",
          "workflow_runtime"
        ],
        "layer": "domain",
        "line_count": 172,
        "path": "scripts/workflow_runtime/release.py"
      },
      {
        "imports": [
          "__future__",
          "json",
          "pathlib",
          "typing",
          "workflow_runtime"
        ],
        "layer": "domain",
        "line_count": 29,
        "path": "scripts/workflow_runtime/resume.py"
      },
      {
        "imports": [
          "__future__",
          "hashlib",
          "json",
          "pathlib",
          "shutil",
          "typing",
          "workflow_runtime"
        ],
        "layer": "domain",
        "line_count": 68,
        "path": "scripts/workflow_runtime/retention.py"
      },
      {
        "imports": [
          "__future__",
          "hashlib",
          "json",
          "pathlib",
          "typing",
          "workflow_runtime"
        ],
        "layer": "domain",
        "line_count": 139,
        "path": "scripts/workflow_runtime/retry.py"
      },
      {
        "imports": [
          "__future__",
          "datetime",
          "hashlib",
          "json",
          "pathlib",
          "typing",
          "workflow_runtime"
        ],
        "layer": "domain",
        "line_count": 116,
        "path": "scripts/workflow_runtime/stage_results.py"
      },
      {